[
{"chain":"monad","token_address":"0x94db948945da0b68a2c230488d33e8679e7a7777","launchpad":"nadfun","contract_address":"0xa7283d07812a02afb7c09b60f8896bcea3f90ace","pool_address":"0x7814925269661f7cc67047e4a860bfa254eaa80e","graduated_at":"2025-11-24T15:17:03Z","block_number":37711528,"tx_hash":"0xb8d82599083f83af19653a07cba6da7b5d6d213b0fccecb7f6c23c3e57917dc6","log_index":63},
{"chain":"monad","token_address":"0x96079813ddec84bb1747d8e180154d8e096e7777","launchpad":"nadfun","contract_address":"0xa7283d07812a02afb7c09b60f8896bcea3f90ace","pool_address":"0x72eda68fd34b5dc0f92105e7c4d08be09476d6fc","graduated_at":"2025-11-24T15:18:37Z","block_number":37711763,"tx_hash":"0xf2a7cd395e389ace3111d3c5cb2c3839fcbee56b0f4c107c81e0232c43a8385b","log_index":101},
{"chain":"monad","token_address":"0x5df178c7e58046bc9074782fef0009c6be167777","launchpad":"nadfun","contract_address":"0xa7283d07812a02afb7c09b60f8896bcea3f90ace","pool_address":"0x2c492d8b6b103be68df5ec37e709750ae3d3444e","graduated_at":"2025-11-24T15:24:11Z","block_number":37712584,"tx_hash":"0xbab69a7530e2d41792cd74b59978154df9679a33a71dd359ed19dd596657d65d","log_index":239},
{"chain":"monad","token_address":"0x39b9e06f226ff6d7500c870b82333aacbd2f7777","launchpad":"nadfun","contract_address":"0xa7283d07812a02afb7c09b60f8896bcea3f90ace","pool_address":"0xf4e40aaea62c8b6a023b1f0250e096979b6d28ea","graduated_at":"2025-11-24T15:27:31Z","block_number":37713082,"tx_hash":"0x888a1c0665c3b331e43c95fb3bdf5e60721df1a87a152510c569ef66dcef16d9","log_index":45},
{"chain":"monad","token_address":"0xc0ddaf8326780cd7a936ca1e792bb671c5987777","launchpad":"nadfun","contract_address":"0xa7283d07812a02afb7c09b60f8896bcea3f90ace","pool_address":"0xa788a38a2cf9d11f15cc0adca5c51901bd77d614","graduated_at":"2025-11-24T15:27:39Z","block_number":37713103,"tx_hash":"0x231db0184ffb735e33cb0e4a38ed26121f21728c7b7877e3ab1902b31d370e99","log_index":22},
{"chain":"monad","token_address":"0x7b2728c04ad436153285702e969e6efac3a97777","launchpad":"nadfun","contract_address":"0xa7283d07812a02afb7c09b60f8896bcea3f90ace","pool_address":"0x3e1523b270867762a49340389bdea9b8658994aa","graduated_at":"2025-11-24T15:30:25Z","block_number":37713514,"tx_hash":"0xaf3a36bfa8c59e9223c43298f8e95869e1abde70c8441271c257d4e6d7d8d136","log_index":34},
{"chain":"monad","token_address":"0xbb97e5ec82c4febf60f881cc8f489c16dd597777","launchpad":"nadfun","contract_address":"0xa7283d07812a02afb7c09b60f8896bcea3f90ace","pool_address":"0x147301f5f094fb99b4ad7a9314868bf800d46bfe","graduated_at":"2025-11-24T15:31:42Z","block_number":37713699,"tx_hash":"0x0339d7a8d52b456e531ce544f9dae07dfec229cb1f405e8a43134a669ad66af5","log_index":61},
{"chain":"monad","token_address":"0x0de6c50fe941f2bc46c0190ba6cbd44fe0bb7777","launchpad":"nadfun","contract_address":"0xa7283d07812a02afb7c09b60f8896bcea3f90ace","pool_address":"0x50f5341ef1042e6af71116f57d77c9160db5d827","graduated_at":"2025-11-24T15:32:12Z","block_number":37713770,"tx_hash":"0xfc4b7418c9306acfb6b02c4def4f6cf94759fbaefa0934113dd682cdecb991d4","log_index":236},
{"chain":"monad","token_address":"0x7de6432b490bbc00c8e14550f1098bb607bc7777","launchpad":"nadfun","contract_address":"0xa7283d07812a02afb7c09b60f8896bcea3f90ace","pool_address":"0xf7e164d0a8d2759d0681753bc36ee38e9c98266f","graduated_at":"2025-11-24T15:41:59Z","block_number":37715221,"tx_hash":"0x9c39e90b9fdfb16d09303dee5e6421e1641027c495d4a712549e64969cf3cba3","log_index":78},
{"chain":"monad","token_address":"0x3744ac3489f22f7a6a99943abbc320b3609b7777","launchpad":"nadfun","contract_address":"0xa7283d07812a02afb7c09b60f8896bcea3f90ace","pool_address":"0x6d94b9047b8d42c5d520a15f57919d2d2ebe292e","graduated_at":"2025-11-24T15:57:05Z","block_number":37717448,"tx_hash":"0xd69c00322abafc3c1666fd112c9f0652920ce6687fcddf278e6b2349b1efb612","log_index":30},
{"chain":"monad","token_address":"0xd7c1ef91eb1af34f9ae9e9206285ad56c50c7777","launchpad":"nadfun","contract_address":"0xa7283d07812a02afb7c09b60f8896bcea3f90ace","pool_address":"0xd5bf41b23fbac3c5b0d97692d6214e1c15238148","graduated_at":"2025-11-24T16:17:08Z","block_number":37720404,"tx_hash":"0xf5cdf813fda1978e4195e1d4a30737d6658d2bb20eca576107a6c5f843d4cd61","log_index":30},
{"chain":"monad","token_address":"0x23c26bd5d55e0d3c1985e23ef2a377c0e2547777","launchpad":"nadfun","contract_address":"0xa7283d07812a02afb7c09b60f8896bcea3f90ace","pool_address":"0xfdc9ea59981b459475f0cd4071f89cf4efb68789","graduated_at":"2025-11-24T16:17:53Z","block_number":37720517,"tx_hash":"0x8d563e9b7454d6a37a2b3f8420dabc27bb110af70d1ad39329b840ba03d860c7","log_index":70},
{"chain":"monad","token_address":"0xaca86430cccedbedb35910fc8a5afef07da37777","launchpad":"nadfun","contract_address":"0xa7283d07812a02afb7c09b60f8896bcea3f90ace","pool_address":"0x7d03647462615402e0798fe4488c62addb8da52b","graduated_at":"2025-11-24T16:24:57Z","block_number":37721562,"tx_hash":"0xec4d3afde21b75958c8ffffbd076dd021185225f70c93937b7b543a000af0386","log_index":51},
{"chain":"monad","token_address":"0x405b6330e213ded490240cbcdd64790806827777","launchpad":"nadfun","contract_address":"0xa7283d07812a02afb7c09b60f8896bcea3f90ace","pool_address":"0xaa5de197f90564e9c5fff2bea6581714f9a1d330","graduated_at":"2025-11-24T16:27:01Z","block_number":37721869,"tx_hash":"0x79246043b60067005e6d7b12e3ecb7305683ef2de1f24da7a335b9d4bf91bb06","log_index":67},
{"chain":"monad","token_address":"0xc27a31f34427377b308322fda5fc0f232e957777","launchpad":"nadfun","contract_address":"0xa7283d07812a02afb7c09b60f8896bcea3f90ace","pool_address":"0xccd2800993cffa226724a516f25e06bc10110bbc","graduated_at":"2025-11-24T16:34:23Z","block_number":37722959,"tx_hash":"0xc742cbda49bb0ffce94978142c7ea529c1f94feb0db7624ab368a626df8c1fe2","log_index":66},
{"chain":"monad","token_address":"0x745912a153717ad7c151a6a06f2e31e420517777","launchpad":"nadfun","contract_address":"0xa7283d07812a02afb7c09b60f8896bcea3f90ace","pool_address":"0x119ddfd674019fb17c17f11b22dfdce2c36e4250","graduated_at":"2025-11-24T16:35:44Z","block_number":37723161,"tx_hash":"0x946e5da30abb93cab4a1bcbbefd52f5603be4faaf44284fee34afa7f9b8292a8","log_index":15},
{"chain":"monad","token_address":"0xa7b3f394b9aaba67f2543a8c1a0f753cc68d7777","launchpad":"nadfun","contract_address":"0xa7283d07812a02afb7c09b60f8896bcea3f90ace","pool_address":"0x87706e1510826ab7ea3186fac96c3ab6c8a7238d","graduated_at":"2025-11-24T16:42:58Z","block_number":37724206,"tx_hash":"0x1334f2411faf35b341f8e53aa0cfc5d6bb55b5f6ed93b8c7020c93dc3590cab2","log_index":43},
{"chain":"monad","token_address":"0xe8548976ddddcc9447208ca3a776848337037777","launchpad":"nadfun","contract_address":"0xa7283d07812a02afb7c09b60f8896bcea3f90ace","pool_address":"0x1b90b81bfa12ef980eb5c0ce6093b338191e62c2","graduated_at":"2025-11-24T16:45:30Z","block_number":37724567,"tx_hash":"0x9aa20c8f62d40322cb3a5c36b07bc1d4c906725fe915f5c23c5891b713a52e90","log_index":71},
{"chain":"monad","token_address":"0xbadfb857a69aff0449204aa769373f8599007777","launchpad":"nadfun","contract_address":"0xa7283d07812a02afb7c09b60f8896bcea3f90ace","pool_address":"0xda79bc413d4dbd335be4cf068740a789d0a7facb","graduated_at":"2025-11-24T16:55:18Z","block_number":37725989,"tx_hash":"0x53bd9b55233b15e2125f19ce6ad858a8d139fd9fc4300f55124b49c1afac53d4","log_index":140},
{"chain":"monad","token_address":"0x9a17ad79acc180f911be1b89f6fd566597fd7777","launchpad":"nadfun","contract_address":"0xa7283d07812a02afb7c09b60f8896bcea3f90ace","pool_address":"0x73a8ec246bd222c934604053b2d3cf07b2426c91","graduated_at":"2025-11-24T17:02:12Z","block_number":37727002,"tx_hash":"0x1298af5065f5ca920d3bfd6133cb4f6d865b5b3e0877b104ecb99147e099e46b","log_index":23},
{"chain":"monad","token_address":"0x25d5934ce90228b9b7ce03999b81069ab6297777","launchpad":"nadfun","contract_address":"0xa7283d07812a02afb7c09b60f8896bcea3f90ace","pool_address":"0x30611e9394aab30f450ee7cb7849251ff61ad8d9","graduated_at":"2025-11-24T17:09:27Z","block_number":37728069,"tx_hash":"0xe3a166d9fa8a94f0de8ef251abc0eea12f79386fa8f73cf5100acca9ae9676ed","log_index":57},
{"chain":"monad","token_address":"0xdb85854437030dc327100dd6942f21a27a2c7777","launchpad":"nadfun","contract_address":"0xa7283d07812a02afb7c09b60f8896bcea3f90ace","pool_address":"0xd004cfed6f1ae96fe91e0cd68bc02068ba42da29","graduated_at":"2025-11-24T17:33:47Z","block_number":37731699,"tx_hash":"0x16e1a8f53357117f90374f6e85c83266c9e60f51e6a6c93e4e6c7e13b91af343","log_index":17},
{"chain":"monad","token_address":"0x73b62ff5cfea3fb857dbe84a57f1631630247777","launchpad":"nadfun","contract_address":"0xa7283d07812a02afb7c09b60f8896bcea3f90ace","pool_address":"0x1201512d6082a4c587628491c7b72b463bcbc1d6","graduated_at":"2025-11-24T17:35:11Z","block_number":37731906,"tx_hash":"0x4bd1923ac886e5d83ce5b7f67d5644f10db7fcf23360d1f5243c58dac0a1caf1","log_index":56},
{"chain":"monad","token_address":"0xde22b2d5b92364fec7065c638ad82509949f7777","launchpad":"nadfun","contract_address":"0xa7283d07812a02afb7c09b60f8896bcea3f90ace","pool_address":"0x776059ee138ac8811847e8f124e84a6bbf881d8d","graduated_at":"2025-11-24T17:40:47Z","block_number":37732742,"tx_hash":"0xa9e734eb4b830c769cf5b847153661d428988675321ea3987b606dc46db402e3","log_index":34},
{"chain":"monad","token_address":"0x00b684ce62906ae3d3036fe384aec6f216657777","launchpad":"nadfun","contract_address":"0xa7283d07812a02afb7c09b60f8896bcea3f90ace","pool_address":"0xdac5896be553f21f91a92080c13251eb9e7be199","graduated_at":"2025-11-24T17:43:16Z","block_number":37733112,"tx_hash":"0xcb981bc961cd1728e22e62b2bac4af0da7ddb6fe756b413aa02c06eb955e48fd","log_index":50},
{"chain":"monad","token_address":"0xd75342415353528dde8fd4c13e4b0db457407777","launchpad":"nadfun","contract_address":"0xa7283d07812a02afb7c09b60f8896bcea3f90ace","pool_address":"0x0cf4e2c7c75d4ca148ee55f1cbe010f4a45b51de","graduated_at":"2025-11-24T17:53:46Z","block_number":37734683,"tx_hash":"0xcd0e0b0c4645e2636bdc7a83b26e086f96086c9add9d57c9ba5e4dcb3231b85e","log_index":45},